StartDate,EndDate,Status,IPAddress,Progress,Duration (in seconds),Finished,RecordedDate,ResponseId,RecipientLastName,RecipientFirstName,RecipientEmail,ExternalReference,LocationLatitude,LocationLongitude,DistributionChannel,UserLanguage,Q1,Q2,Q2_5_TEXT,Q3,Q3_5_TEXT,Q4,Q4_6_TEXT,Q4_10_TEXT,Q5,Q6,Q6_6_TEXT,Q7,Q8,Q9,Q10_1,Q10_2,Q10_3,Q10_4,Q11,Q11_10_TEXT,Q12,Q13,Q14,Q15,Q15_14_TEXT,Q16,Q17,Q18,Q19_1,Q19_2,Q19_3,Q19_4,Q20,Q20_10_TEXT,Q21,Q22,Q23,Q24,Q24_15_TEXT,Q25,Q26,Q27,Q28_1,Q28_2,Q28_3,Q28_4,Q29,Q29_10_TEXT,Q30,Q31,Q32,Q33,Q33_14_TEXT,Q34,Q35,Q36,Q37,Q37_1_TEXT,Q37_2_TEXT,Q38,Q39,Q40,Q41,Q42,Q43
Start Date,End Date,Response Type,IP Address,Progress,Duration (in seconds),Finished,Recorded Date,Response ID,Recipient Last Name,Recipient First Name,Recipient Email,External Data Reference,Location Latitude,Location Longitude,Distribution Channel,User Language,"If comfortable, please share your age.","If comfortable, please share your gender identity. Choose all that apply. - Selected Choice","If comfortable, please share your gender identity. Choose all that apply. - Other - Text","If comfortable, please share your sexual orientation. Choose all that apply. - Selected Choice","If comfortable, please share your sexual orientation. Choose all that apply. - Other - Text","If comfortable, please share your race. Choose all that apply. - Selected Choice","If comfortable, please share your race. Choose all that apply. - First Nations or Indigenous (please specify) - Text","If comfortable, please share your race. Choose all that apply. - Others - Text",Please share your faculty.,How would you best identify your role on campus? - Selected Choice,How would you best identify your role on campus? - Other - Text,"How many years have you been on campus, including all roles you may have filled on campus (e.g., student and staff, student and faculty, etc.)?","Prior to starting this survey and reviewing the definitions provided, how familiar were you with the concepts of misogyny, queerphobia, and transphobia?","Would you like to add anything to the above definitions of misogyny, queerphobia, and transphobia to better contextualize these definitions within our campus culture?",Have you observed instances of misogyny within: - Your campus community,Have you observed instances of misogyny within: - The classroom,Have you observed instances of misogyny within: - Conversations with your peers,Have you observed instances of misogyny within: - Conversations with staff/faculty,"Have you personally experienced instances of misogyny on campus? If comfortable, please share how and in what context. - Selected Choice","Have you personally experienced instances of misogyny on campus? If comfortable, please share how and in what context. - Yes, please specify: - Text",How have you seen misogyny addressed on campus in the past?,"Going forward, in what other ways would you like to see misogyny addressed?","Has the presence of misogyny impacted your experience on campus? If so, if comfortable, please describe how and in what context.","Have you witnessed misogyny online? If so, in what contexts? Please be as specific as possible. - Selected Choice","Have you witnessed misogyny online? If so, in what contexts? Please be as specific as possible. - Yes, please specify: - Text",Is the misogyny you experienced on campus comparable to the experiences of misogyny online?,"In your opinion, does misogyny on campus take the same form of misogyny online?",Has instances of misogyny ever constrained your learning or your participation in community?,Have you observed instances of queerphobia within: - Your campus community,Have you observed instances of queerphobia within: - The classroom,Have you observed instances of queerphobia within: - Conversations with your peers,Have you observed instances of queerphobia within: - Conversations with staff/faculty,"Have you you experienced instances of queerphobia on campus? If comfortable, please share how and where. - Selected Choice","Have you you experienced instances of queerphobia on campus? If comfortable, please share how and where. - Yes, please specify: - Text",How have you seen queerphobia addressed on campus in the past?,What other ways would you like to see queerphobia addressed?,Has the presence of queerphobia impacted your experience on campus?,"Have you witnessed queerphobia online? If so, in what contexts? Please be as specific as possible. - Selected Choice","Have you witnessed queerphobia online? If so, in what contexts? Please be as specific as possible. - Yes, please specify: - Text",Is the queerphobia you experienced on campus comparable to the experiences online?,"In your opinion, does queerphobia on campus take the same form of queerphobia online?",Has instances of queerphobia ever constrained your learning or your participation in community?,Have you observed instances of transphobia within: - Your campus community,Have you observed instances of transphobia within: - The classroom,Have you observed instances of transphobia within: - Conversations with your peers,Have you observed instances of transphobia within: - Conversations with staff/faculty,"Have you personally experienced instances of transphobia on campus? If comfortable, please share how and in what context. - Selected Choice","Have you personally experienced instances of transphobia on campus? If comfortable, please share how and in what context. - Yes, please specify: - Text",How have you seen transphobia addressed on campus in the past?,What other ways would you like to see transphobia addressed?,Has the presence of transphobia impacted your experience on campus?,"Have you witnessed transphobia online?  If so, in what contexts? Please be as specific as possible. - Selected Choice","Have you witnessed transphobia online?  If so, in what contexts? Please be as specific as possible. - Yes, please specify: - Text",Is the transphobia you experienced on campus comparable to the experiences online?,"In your opinion, does transphobia on campus take the same form of transphobia online?",Has instances of transphobia ever constrained your learning or your participation in community?,Are you or have you ever sought community support or care on campus? - Selected Choice,Are you or have you ever sought community support or care on campus? - Yes (please expand) - Text,Are you or have you ever sought community support or care on campus? - Maybe (please expand) - Text,Was it easy to find?,Was it effective?,If your experience wasn’t helpful what could have made it better?,What kinds of advocacy would you like to see on campus to help you feel better supported?,Do you feel that you have sufficient education around sexism and misogyny in the classroom?,How comfortable would you be expressing your thoughts on sexism and misogyny in the classroom?
"{""ImportId"":""startDate"",""timeZone"":""America/Denver""}","{""ImportId"":""endDate"",""timeZone"":""America/Denver""}","{""ImportId"":""status""}","{""ImportId"":""ipAddress""}","{""ImportId"":""progress""}","{""ImportId"":""duration""}","{""ImportId"":""finished""}","{""ImportId"":""recordedDate"",""timeZone"":""America/Denver""}","{""ImportId"":""_recordId""}","{""ImportId"":""recipientLastName""}","{""ImportId"":""recipientFirstName""}","{""ImportId"":""recipientEmail""}","{""ImportId"":""externalDataReference""}","{""ImportId"":""locationLatitude""}","{""ImportId"":""locationLongitude""}","{""ImportId"":""distributionChannel""}","{""ImportId"":""userLanguage""}","{""ImportId"":""QID17_TEXT""}","{""ImportId"":""QID16""}","{""ImportId"":""QID16_5_TEXT""}","{""ImportId"":""QID58""}","{""ImportId"":""QID58_5_TEXT""}","{""ImportId"":""QID18""}","{""ImportId"":""QID18_6_TEXT""}","{""ImportId"":""QID18_10_TEXT""}","{""ImportId"":""QID31""}","{""ImportId"":""QID33""}","{""ImportId"":""QID33_6_TEXT""}","{""ImportId"":""QID32""}","{""ImportId"":""QID27""}","{""ImportId"":""QID28_TEXT""}","{""ImportId"":""QID19_1""}","{""ImportId"":""QID19_2""}","{""ImportId"":""QID19_3""}","{""ImportId"":""QID19_4""}","{""ImportId"":""QID7""}","{""ImportId"":""QID7_10_TEXT""}","{""ImportId"":""QID5_TEXT""}","{""ImportId"":""QID35_TEXT""}","{""ImportId"":""QID36_TEXT""}","{""ImportId"":""QID8""}","{""ImportId"":""QID8_14_TEXT""}","{""ImportId"":""QID37""}","{""ImportId"":""QID38""}","{""ImportId"":""QID39""}","{""ImportId"":""QID40_1""}","{""ImportId"":""QID40_2""}","{""ImportId"":""QID40_3""}","{""ImportId"":""QID40_4""}","{""ImportId"":""QID41""}","{""ImportId"":""QID41_10_TEXT""}","{""ImportId"":""QID42_TEXT""}","{""ImportId"":""QID43_TEXT""}","{""ImportId"":""QID44_TEXT""}","{""ImportId"":""QID45""}","{""ImportId"":""QID45_15_TEXT""}","{""ImportId"":""QID46""}","{""ImportId"":""QID47""}","{""ImportId"":""QID48""}","{""ImportId"":""QID49_1""}","{""ImportId"":""QID49_2""}","{""ImportId"":""QID49_3""}","{""ImportId"":""QID49_4""}","{""ImportId"":""QID50""}","{""ImportId"":""QID50_10_TEXT""}","{""ImportId"":""QID51_TEXT""}","{""ImportId"":""QID52_TEXT""}","{""ImportId"":""QID53_TEXT""}","{""ImportId"":""QID54""}","{""ImportId"":""QID54_14_TEXT""}","{""ImportId"":""QID55""}","{""ImportId"":""QID56""}","{""ImportId"":""QID57""}","{""ImportId"":""QID9""}","{""ImportId"":""QID9_1_TEXT""}","{""ImportId"":""QID9_2_TEXT""}","{""ImportId"":""QID10""}","{""ImportId"":""QID11""}","{""ImportId"":""QID12_TEXT""}","{""ImportId"":""QID13_TEXT""}","{""ImportId"":""QID14_TEXT""}","{""ImportId"":""QID15_TEXT""}"
2025-01-15 09:24:49,2025-01-15 09:28:44,Survey Preview,,100,234,True,2025-01-15 09:28:45,R_3jptxxTDQAfNd2r,,,,,43.474,-80.554,preview,EN,,,,,,,,,,,,,,,,,,,,,,,,,,,,,,,,,,,,,,,,,,,,,,,,,,,,,,,,,,,,,,,,,
2025-01-17 10:41:54,2025-01-17 11:48:43,IP Address,192.159.178.162,100,4008,True,2025-01-17 11:48:44,R_5AEvmbgeUGXhTOO,,,,,43.474,-80.554,anonymous,EN,21,"Woman (includes cis women, trans women, and anyone else who identifies as a woman)",,,,"Black (African, Afro-Caribbean, Black-Canadian, Afro-Latine, African-American, or other African descent)",,,Arts,Undergraduate Student,,3-5,Very familiar,,Yes,Yes,Yes,Unsure,Unsure,,"I've seen offerings of programming by student services such as bystander workshops ","I would like to see it directly addressed (ie named) by the university. Having workshops, info sessions, or even just content introduced in courses (and not just arts courses) that identifies the presence of misogyny on campuses.","I think there is a general feeling of misogyny intertwined with the university's culture - as a STEM university, there are many spaces which feel like a ""boys club"" and likely discourage others to enter such spaces. I find myself uncomfortable with venturing outside of arts spaces for this reason, and feel as though I wouldn't be taken seriously or respected in events or clubs that aren't hosted by the arts.","Yes, please specify:","UW-related servers on reddit are rampant with misogyny and other types of intolerance- women are often talked about in objectifying ways (students and faculty alike). In the comment section of UW's instagram, there are often hateful comments under any kind of social-justice posts.",Yes,Somewhat,Yes,Yes,Yes,Yes,Unsure,Unsure,,"Mostly through student services providing spaces for queer students (ie glow, specific athletic sessions) but that's not really the same as directly addressing queerphobia","Once again, by acknowledging that it exists and having more outreach initiatives to gather what needs students really have -- training sessions for staff and students, more careful regulation of online servers (ie. the UW instagram says they delete hate comments, but they do not.)",I've been hesitant to enter certain spaces out of fear that there would be queerphobia present (certainly spaces that have clear religious connections). Worrying that coming out in any capacity would impact how peers/coworkers treat me.,"Yes, please specify:","Again, lots of hate comments on places like instagram, reddit, etc. ",Somewhat,Somewhat,Yes,Yes,Yes,Yes,Unsure,Unsure,,"Again, spaces for trans folks in athletics and things like that, but not necessarily addressing transphobia specifically.","Through course content and efforts to always use inclusive language within course assignments and other materials, staff and student training, more monitoring of online spaces to reduce the hate being posted online, having active communications with trans members of the community to identify what their needs truly are and then swift work by the university to address those needs on campus.",,"Yes, please specify:","Lots of hate comments on instagram, hate under posts about drag performances on campus, i have seen students posting/circulating transphobic rhetoric and disinformation on their personal accounts",Yes,Somewhat,Unsure,Yes (please expand),"I have looked into counselling services for mental health support, but was unable to access support right away due to demand. I was also told that it would be impossible to book follow-up sessions with the same person, which would mean introducing myself and starting at square one each time I went for support.",,No,No,"Easy online access (many supports require phone calls, and the phones are only monitored at certain hours). Making clear the distinctions between different types of services, and clearly outlining what is/isn't covered by the university, and how much everything costs. But mostly just increasing the funding and support to student services, as they are never able to keep up with demand- I have honestly never met anyone who has had a positive experience with university supports or services.","People in positions of power that actually understand the struggle that students face and aren't blindsided by catering to shareholders and making a profit. Having open, free access to resources and supports that are capable of recognizing the barriers that many students already face when it comes to advocating for themselves. The university/faculties giving students the opportunity to provide feedback on their lived experiences and then ACTUALLY implementing them in ways that are not just another ""task force.""","No, although I do think it is better in certain arts spaces, it is necessary to have this education being done in ALL programs, because it affects all students. Having tailored discussions about the ways injustice can be perpetuated (overtly and covertly) in different faculties is needed in order to properly address the myriad of ways it occurs at UW. ","I would be very comfortable in theory, but it very much depends on the space that I'm in and the comfort level that has been established by others in the classroom. There have certainly been times where I haven't felt comfortable sharing my true thoughts/feelings on these subjects out of fear for being shut down or viewed differently."
2025-01-17 10:39:19,2025-01-17 11:58:31,IP Address,192.159.178.162,100,4751,True,2025-01-17 11:58:31,R_3DwkxjKPSpbtCMy,,,,,43.474,-80.554,anonymous,EN,21,Non-binary,,,,"South Asian (East Indian, Pakistani, Bangladeshi, Sri Lankan, Indo-Caribbean, or other South Asian descent)",,,Arts,Undergraduate Student,,3-5,Very familiar,N/A,Yes,Yes,Yes,Unsure,"Yes, please specify:","I have seen misogynistic comments etched into the heaters on DP (stuff such as ""send nudes"" or ""body count"" comments). Additionally, certain cis men students have a tendency of filling up a space in classroom discussions and talking over non-men (women and gender-diverse students, staff, and faculty alike). ","Very minimal. Mainly bystander workshops but nothing misogyny-specific. Menstrual equity programs. Most of the anti-misogyny work is being done by student services as opposed to the university itself.  ","Rape culture workshops built into orientation !!! As well as a rehaul of ethics curricula across faculties. Cough cough making a GSJ course a mandatory requirement for all students maybe? ","The misogyny I experience is vastly different due to my masculine presentation, it is typically more intertwined with transphobia. I know for a lot of more fem-presenting folks, they get nervous to deviate from Arts-specific spaces that tend to be more accepting. I have one friend in particular that cites being terrified to go to the Eng buildings alone because they've been made to feel as though they are not smart enough to be in those spaces. ","Yes, please specify:","UWConfessions (especially the rancid comment sections). UWReddit. Lots of objectification. While UW doesn't have a huge fraternity culture, Sigma Chi is rife with rape culture (as most frats are). ",Yes,Somewhat,Yes,Yes,Yes,Yes,Yes,"Yes, please specify:","One time, I was on a date with a girl on campus (we had been holding hands) and some guy on a bike came up to us and started spewing religiosity and trying to Church recruit us. 
Had to explain to an equity specialist what the difference between gender and sexuality is. That's 2SLGBT+ foundations 101. basic stuff. ","Once again, it's student clubs and services doing the work. ","Even just an acknowledgement that it exists. University administration and communications is. very bad at that. Just a quick look at the lack of addressing queerphobic comments and  ","Yes. As previously mentioned, the queerphobic church recruitment took me by surprise. As a result, I struggle a lot with showing basic physical affection with romantic partners or even platonic AFAB friends without feeling like there are eyes on me at any given moment; notably not something straight couples have to worry about. ","Yes, please specify:","Anytime the UW account posts anything related to Pride, the comments are filled to the brim with really awful sentiments. ",Somewhat,Somewhat,Yes,Yes,Yes,Yes,Yes,"Yes, please specify:","The ""Bus to Church"" chalk and posters that shows up on campus. Trinity Bible Church are well-known for their transphobia. 
So many people either straight up refuse to use they/them when addressing me or make some sort of side comment about how they've never met a trans person before. 
Far too many bigoted conversations about trans women in sports it's ridiculous. Transmisogyny in particular is alive and well on our campuses and it stresses me out that trans women and transfems aren't getting the support they need (disproportionately so). Had one of my friends tell me that the trans healthcare doctor on campus refuses to refill prescriptions (especially for HRT) without an appointment (which is narrowly impossible because she's so backlogged) or a fax (which students have to pay for). 
Vivek Goel using ""gender ideology"" during a community forum was crazy work. Goes to show the lack of knowledge surrounding transphobic dogwhistles. ","Anything that has occurred in terms of anti-transphobia support has only been within the last year and therefore is very underdeveloped. Most of the things available are once again student-led initiatives. ","There is no updated map as to where the all-gender washrooms are located which can be really stressful for trans students. Would like more mental health and healthcare specialists readily available for trans students. More programming and case studies offered to students, staff, and faculty on how to address and limit their own indoctrinated transphobia. There is limited knowledge on how students can actually access gender-affirming care. ","You sure bet it has. There are certain spaces where I have just resigned to she/hering myself for ease of sake and sanity. Additionally, walking alone on campus at night is overwhelming (I've heard some of my trans friends tell me they've been stopped by people in cars spewing transphobia). ","Yes, please specify:","UWreddit is a big one. UW official accounts and their comment sections especially during pride month. ",Somewhat,Somewhat,Yes,No,,,Maybe,Maybe,"There are not clear pathways that are made known or available to students outside of student services. And even places like the Women's Centre, GLOW, RAISE are more about creating safe spaces for students because they are routinely roadblocked by WUSA and UW administration whenever they try to make statements or enact plans that will actively help gender-marginalized students on campus. ","More staff and faculty with the knowledge surrounding TFGBV and GBV. ","I think that I actively go out of my way to seek out courses that will cover this information. Generally though, it is very unlikely that students will be given the necessary education. I'm sure if you asked someone who wasn't in arts to explain sexism and misogyny and how they're interconnected, they would not be able to do so. It ought to be mandatory for all students (regardless of program) to take an ARTS First or GSJ course. ","Only in classes where it is pertinent to class content. If it is a situation where I have to call out certain behaviours, I get very quite very quickly out of fear. "
2025-01-20 11:55:49,2025-01-20 11:57:22,IP Address,129.97.124.31,100,92,True,2025-01-20 11:57:22,R_5IxPTqDumdYHf2Y,,,,,43.6249,-79.7876,anonymous,EN,,,,,,,,,,,,,,,,,,,,,,,,,,,,No,,,,,,,,,,,,,,,,,,,,,,,,,,,,,,,,,,,,,
2025-01-20 12:01:10,2025-01-20 12:07:10,Survey Preview,,100,359,True,2025-01-20 12:07:10,R_38MDFOZ4Tz3xaN3,,,,,43.474,-80.554,preview,EN,,,,,,,,,,,,,,,,,,,,,,,,,,,,,,,,,,,,,,,,,,,,,,,,,,,,,,,,,,,,,,,,,
2025-01-23 12:04:53,2025-01-23 12:18:38,IP Address,107.179.134.2,100,825,True,2025-01-23 12:18:39,R_7QRICv3IVBDYtK8,,,,,43.4325,-80.4995,anonymous,EN,46,"Woman (includes cis women, trans women, and anyone else who identifies as a woman)",,Bisexual,,"Black (African, Afro-Caribbean, Black-Canadian, Afro-Latine, African-American, or other African descent)",,,Arts,Faculty,,10+,Very familiar,,Yes,No,Yes,Yes,"Yes, please specify:",in high-level meetings with centraladministration,"blanket statements against misogyny but quite abstract, not definitive in how it will be countered","direct and open conversations about what misogyny can look like, how it impacts all students, and what alternative frameworks we can use in learning and in community relationships","It has created moments where i feel undervalued or dismissed, it has asked me to work beyond my capacity while not accouting for gendered labour divisions","Yes, please specify:","manosphere content, youtube, political campaigns, comment sections",No,No,Yes,Unsure,No,Yes,Yes,"Yes, please specify:",bi-erasure in conversations with faculty and professors,general statements against LGBT+ phobia and hate,greater emphasis on queer led initiatives and forums,has contributed to being less forthcoming about my sexual orientation,"Yes, please specify:",same as misogyny in various platform and comment contexts,Somewhat,No,Yes,Yes,No,No,No,No,,same as all LGBTQ+ messaging,greater support for trans community members and amplification of their work,no,"Yes, please specify:",same as queerphobia and misogyny,No,No,No,No,,,Maybe,Maybe,,,,
2025-01-24 08:38:06,2025-01-24 08:41:39,IP Address,129.97.124.179,100,213,True,2025-01-24 08:41:40,R_6R8Do5RDnb6ll7h,,,,,43.5903,-79.7598,anonymous,EN,21,Other,test,Other,test,Others,,test,Not Applicable,Other,test,3-5,Very familiar,,Yes,Yes,Yes,Yes,Prefer not to answer,,test,test,test,"Yes, please specify:",test,Unsure,Somewhat,Yes,Yes,Yes,Unsure,Unsure,"Yes, please specify:",test,test,test,test,"Yes, please specify:",test,Somewhat,Somewhat,Yes,Yes,Yes,Yes,Yes,"Yes, please specify:",test,test,test,test,"Yes, please specify:",test,Somewhat,Somewhat,Yes,Yes (please expand),test,,No,Maybe,test,test,test,test
2025-01-27 09:00:52,2025-01-27 09:09:24,IP Address,104.28.133.27,100,512,True,2025-01-27 09:09:25,R_1NACbSwQevReICJ,,,,,43.6547,-79.3623,anonymous,EN,21,"Woman (includes cis women, trans women, and anyone else who identifies as a woman),Non-binary",,Lesbian,,"East Asian (Chinese, Korean, Japanese, or other East Asian descent),South Asian (East Indian, Pakistani, Bangladeshi, Sri Lankan, Indo-Caribbean, or other South Asian descent),Southeast Asian (Filipino, Vietnamese, Cambodian, Thai, Malaysian, Indonesian, or other Southeast Asian descent)",,,Arts,Undergraduate Student,,3-5,Very familiar,,Yes,Yes,Yes,Yes,"Yes, please specify:",,,,,"Yes, please specify:",,Somewhat,Somewhat,Unsure,Yes,Yes,Yes,No,"Yes, please specify:",,,,,"Yes, please specify:",,No,No,Unsure,Yes,Yes,Yes,No,No,,,,,"Yes, please specify:",,Unsure,No,Unsure,Maybe (please expand),,,Yes,Maybe,,,,
2025-01-27 09:17:57,2025-01-27 09:20:05,IP Address,129.97.125.11,100,127,True,2025-01-27 09:20:05,R_5n6EA3zjzCqGMoN,,,,,43.5903,-79.7598,anonymous,EN,,,,,,,,,,,,,,,,,,,,,,,,,,,,,,,,,,,,,,,,,,,,,,,,,,,,,,,,,,,,,,,,,
2025-01-27 10:46:47,2025-01-27 10:56:09,IP Address,142.55.0.15,100,561,True,2025-01-27 10:56:09,R_7l434JbaTRWXJyG,,,,,43.6249,-79.7876,anonymous,EN,20,"Woman (includes cis women, trans women, and anyone else who identifies as a woman)",,Straight,,"Middle Eastern (Afghan, Egyptian, Iranian, Lebanese, Turkish, Kurdish, or other Arab or Persian descent)",,,Arts,Undergraduate Student,,0-3,Very familiar,,Unsure,Unsure,Yes,Unsure,Unsure,,Only by female faculty,Make sure that peer reviews are not based on misogyny and ban the anti abortion club!,No,"Yes, please specify:",Any social media platform,No,No,Yes,Unsure,Unsure,Unsure,Unsure,No,,Clubs and societies promoting stuff,Have the admin not just paint a part of the road and call that activism,No,"Yes, please specify:","Any social media post, especially trans individuals",No,No,No,Unsure,Unsure,Unsure,Unsure,No,,Clubs and societies,"Do stuff throughout the year, not just during pride month",No,"Yes, please specify:",Social media posts,No,No,No,No,,,Maybe,,,Ones that don't feel performative and are actually entertaining,"Kinda, but could always improve","Depends on the class demographic/if it feels like a safe space. If I feel safe then absolutely, if not then I'll only state facts to protect my peace"
